{
  "fixture_version": "field-decision-fixtures-1.0",
  "purpose": "synthetic-replay-only-not-market-evidence",
  "query_pack_binding": {"path": "research/query-packs/plan-ac-core-1.1.json", "query_pack_version": "1.1.0", "query_pack_hash": "69ea1e988271dafaaea0ea84cc75e6eac8ad7c884ec4f66212ce57a3a68a3819", "file_sha256": "db652791b73e327bbc2047c369b9c8c71d424505898945d02cd000e9cc07151f"},
  "entity_ids": ["oss-deepdoctection", "oss-docling", "vendor-alice-redque", "vendor-cteni-faktur"],
  "cases": [
    {"id": "deepdoctection-license", "entity_id": "oss-deepdoctection", "lane": "oss_invoice", "field_id": "license_spdx", "candidate_value": "Apache-2.0", "evidence": [{"id": "ev-deep-license", "entity_id": "oss-deepdoctection", "field_id": "license_spdx", "evidence_class": "repository_metadata", "url": "https://github.com/deepdoctection/deepdoctection/blob/main/LICENSE", "page_title": "Deepdoctection repository license fixture", "captured_at": "2026-08-14T06:00:00Z", "locator": "synthetic:line:1", "synthetic_capture": "Synthetic capture: license identifier is Apache-2.0.", "capture_sha256": "f57bbe1fef825aed7b37565311273266e63a6190770f1b5ba2c396265a9b137d", "synthetic_excerpt": "Synthetic capture: license identifier is Apache-2.0.", "excerpt_sha256": "f57bbe1fef825aed7b37565311273266e63a6190770f1b5ba2c396265a9b137d", "assertions": [{"field_id": "license_spdx", "effect": "supports", "value": "Apache-2.0"}]}], "expected": "supports"},
    {"id": "deepdoctection-local", "entity_id": "oss-deepdoctection", "lane": "oss_invoice", "field_id": "local_execution", "candidate_value": true, "evidence": [{"id": "ev-deep-local", "entity_id": "oss-deepdoctection", "field_id": "local_execution", "evidence_class": "official_primary", "url": "https://github.com/deepdoctection/deepdoctection/blob/main/README.md", "page_title": "Deepdoctection local execution fixture", "captured_at": "2026-08-14T06:00:00Z", "locator": "synthetic:paragraph:1", "synthetic_capture": "Synthetic capture: the evaluated processing path can run locally.", "capture_sha256": "9a5b350eb5e35a4c03e391805b48e61508acbca0824ea13f9b82cd8244739a0d", "synthetic_excerpt": "Synthetic capture: the evaluated processing path can run locally.", "excerpt_sha256": "9a5b350eb5e35a4c03e391805b48e61508acbca0824ea13f9b82cd8244739a0d", "assertions": []}], "expected": "does_not_establish"},
    {"id": "docling-outputs", "entity_id": "oss-docling", "lane": "oss_invoice", "field_id": "structured_output_ids", "candidate_value": ["json", "text"], "evidence": [{"id": "ev-docling-outputs", "entity_id": "oss-docling", "field_id": "structured_output_ids", "evidence_class": "official_primary", "url": "https://docling-project.github.io/docling/usage/", "page_title": "Docling structured outputs fixture", "captured_at": "2026-08-14T06:00:00Z", "locator": "synthetic:paragraph:1", "synthetic_capture": "Synthetic capture: JSON and text are explicitly documented outputs.", "capture_sha256": "a0463e6d927d60711150d3fd5d4052fbc2cc902e60873ffd4eaafa1db57c5da4", "synthetic_excerpt": "Synthetic capture: JSON and text are explicitly documented outputs.", "excerpt_sha256": "a0463e6d927d60711150d3fd5d4052fbc2cc902e60873ffd4eaafa1db57c5da4", "assertions": [{"field_id": "structured_output_ids", "effect": "supports", "value": ["text", "json"]}]}], "expected": "supports"},
    {"id": "docling-stars", "entity_id": "oss-docling", "lane": "oss_invoice", "field_id": "github_stars", "candidate_value": 100, "evidence": [{"id": "ev-docling-stars", "entity_id": "oss-docling", "field_id": "github_stars", "evidence_class": "repository_metadata", "url": "https://api.github.com/repos/docling-project/docling", "page_title": "Docling repository metrics fixture", "captured_at": "2026-08-14T06:00:00Z", "locator": "synthetic:line:1", "synthetic_capture": "Synthetic capture: repository stargazers count is 101.", "capture_sha256": "5fc6b0e042a79e7841b5cbee51b8c31b45cf62f1c7af588f9deddea1af48c890", "synthetic_excerpt": "Synthetic capture: repository stargazers count is 101.", "excerpt_sha256": "5fc6b0e042a79e7841b5cbee51b8c31b45cf62f1c7af588f9deddea1af48c890", "assertions": [{"field_id": "github_stars", "effect": "contradicts", "value": 101}]}], "expected": "conflicts"},
    {"id": "alice-received-extraction", "entity_id": "vendor-alice-redque", "lane": "czech_invoice_software", "field_id": "received_invoice_extraction", "candidate_value": true, "evidence": [{"id": "ev-alice-extraction", "entity_id": "vendor-alice-redque", "field_id": "received_invoice_extraction", "evidence_class": "official_primary", "url": "https://alice.redque.cz/funkce", "page_title": "Alice received invoice extraction fixture", "captured_at": "2026-08-14T06:00:00Z", "locator": "synthetic:paragraph:1", "synthetic_capture": "Synthetic capture: received invoice fields are extracted.", "capture_sha256": "7ccdad8333a0fca5233a357e03d1858d64b91ce8d19f97efba39609f2a60691e", "synthetic_excerpt": "Synthetic capture: received invoice fields are extracted.", "excerpt_sha256": "7ccdad8333a0fca5233a357e03d1858d64b91ce8d19f97efba39609f2a60691e", "assertions": [{"field_id": "received_invoice_extraction", "effect": "supports", "value": true}]}], "expected": "supports"},
    {"id": "alice-export-formats", "entity_id": "vendor-alice-redque", "lane": "czech_invoice_software", "field_id": "export_format_ids", "candidate_value": ["csv", "xml"], "evidence": [{"id": "ev-alice-formats", "entity_id": "vendor-alice-redque", "field_id": "export_format_ids", "evidence_class": "official_secondary", "url": "https://www.redque.cz/alice", "page_title": "Alice export format fixture", "captured_at": "2026-08-14T06:00:00Z", "locator": "synthetic:paragraph:1", "synthetic_capture": "Synthetic capture: CSV and XML are explicitly documented export formats.", "capture_sha256": "88a2c8ccf909550ebe067d33338c9277ca6820dfc8d2b04b64aa71f07f5c3516", "synthetic_excerpt": "Synthetic capture: CSV and XML are explicitly documented export formats.", "excerpt_sha256": "88a2c8ccf909550ebe067d33338c9277ca6820dfc8d2b04b64aa71f07f5c3516", "assertions": []}], "expected": "does_not_establish"},
    {"id": "cteni-pricing", "entity_id": "vendor-cteni-faktur", "lane": "czech_invoice_software", "field_id": "pricing", "candidate_value": {"disclosure_status": "public_exact", "currency": "CZK", "vat_status": "excluded", "billing_period": "month", "unit": "subscription", "tiers": [{"name": "Synthetic Standard", "amount": 300, "included_units": null, "overage_amount": null}], "notes": "Synthetic fixture only."}, "evidence": [{"id": "ev-cteni-price", "entity_id": "vendor-cteni-faktur", "field_id": "pricing", "evidence_class": "official_primary", "url": "https://ctenifaktur.cz/cenik", "page_title": "Cteni Faktur structured pricing fixture", "captured_at": "2026-08-14T06:00:00Z", "locator": "synthetic:paragraph:1", "synthetic_capture": "Synthetic capture: public price is CZK 300 per month, excluding VAT, per subscription.", "capture_sha256": "e6074152218bd58cd1bcc3358464ff335891bfeae5bd5f2dde6c270f10f95622", "synthetic_excerpt": "Synthetic capture: public price is CZK 300 per month, excluding VAT, per subscription.", "excerpt_sha256": "e6074152218bd58cd1bcc3358464ff335891bfeae5bd5f2dde6c270f10f95622", "assertions": [{"field_id": "pricing", "effect": "supports", "value": {"disclosure_status": "public_exact", "currency": "CZK", "vat_status": "excluded", "billing_period": "month", "unit": "subscription", "tiers": [{"name": "Synthetic Standard", "amount": 300, "included_units": null, "overage_amount": null}], "notes": "Synthetic fixture only."}}]}], "expected": "supports"},
    {"id": "cteni-approval-conflict", "entity_id": "vendor-cteni-faktur", "lane": "czech_invoice_software", "field_id": "approval_gate_before_export", "candidate_value": true, "evidence": [{"id": "ev-cteni-approval-a", "entity_id": "vendor-cteni-faktur", "field_id": "approval_gate_before_export", "evidence_class": "official_primary", "url": "https://ctenifaktur.cz/funkce", "page_title": "Cteni Faktur approval workflow fixture", "captured_at": "2026-08-14T06:00:00Z", "locator": "synthetic:paragraph:1", "synthetic_capture": "Synthetic capture: one source documents an approval gate before export.", "capture_sha256": "338d117a1c632babeaa92d208c49ef0ff3841589bc9d9172ad7e9a842b130eac", "synthetic_excerpt": "Synthetic capture: one source documents an approval gate before export.", "excerpt_sha256": "338d117a1c632babeaa92d208c49ef0ff3841589bc9d9172ad7e9a842b130eac", "assertions": [{"field_id": "approval_gate_before_export", "effect": "supports", "value": true}]}, {"id": "ev-cteni-approval-b", "entity_id": "vendor-cteni-faktur", "field_id": "approval_gate_before_export", "evidence_class": "independent_secondary", "url": "https://example.org/reviews/cteni-faktur-approval", "page_title": "Independent approval workflow fixture", "captured_at": "2026-08-14T06:00:00Z", "locator": "synthetic:paragraph:1", "synthetic_capture": "Synthetic capture: another source says export can occur without an approval transition.", "capture_sha256": "04ec62ac806fcda50493db48b30786885e80b514420117b699c47213bb50f731", "synthetic_excerpt": "Synthetic capture: another source says export can occur without an approval transition.", "excerpt_sha256": "04ec62ac806fcda50493db48b30786885e80b514420117b699c47213bb50f731", "assertions": [{"field_id": "approval_gate_before_export", "effect": "contradicts", "value": false}]}], "expected": "conflicts"}
  ]
}
